{
  "$schema": "../../schema/vergelijking.schema.json",
  "versie": 1,
  "gegenereerdOp": "2026-09-24T19:47:06.216Z",
  "valuta": "EUR",
  "btw": "inclusief",
  "opmerking": "Alle bedragen zijn inclusief 21% btw. Velden met 'MetEnergiebelasting' tellen ook de energiebelasting van de Belastingdienst mee; de andere niet. Netbeheerkosten en de belastingvermindering per aansluiting zitten nergens in.",
  "vandaag": {
    "datum": "2026-09-24",
    "stroomBron": "energyzero",
    "gasMarktgemiddeldeInclBtw": 0.86515,
    "energiebelastingInclBtw": {
      "stroomPerKwh": 0.110848,
      "gasPerM3": 0.726799,
      "verminderingPerAansluitingPerJaar": 628.958
    },
    "leveranciers": [
      {
        "id": "anwb",
        "naam": "ANWB Energie",
        "geverifieerd": true,
        "vastPerMaandInclBtw": {
          "stroom": null,
          "gas": null
        },
        "gasPrijsInclBtw": 0.94195,
        "gasPrijsMetEnergiebelastingInclBtw": 1.668749
      },
      {
        "id": "budget",
        "naam": "Budget Thuis (Budget Energie)",
        "geverifieerd": true,
        "vastPerMaandInclBtw": {
          "stroom": 5.99,
          "gas": 5.99
        },
        "gasPrijsInclBtw": 0.92928,
        "gasPrijsMetEnergiebelastingInclBtw": 1.656079
      },
      {
        "id": "frank",
        "naam": "Frank Energie",
        "geverifieerd": true,
        "vastPerMaandInclBtw": {
          "stroom": 7,
          "gas": 7
        },
        "gasPrijsInclBtw": 0.94501,
        "gasPrijsMetEnergiebelastingInclBtw": 1.671809
      },
      {
        "id": "liveenergy",
        "naam": "Live Energy",
        "geverifieerd": true,
        "vastPerMaandInclBtw": {
          "stroom": 6.05,
          "gas": 6.05
        },
        "gasPrijsInclBtw": 0.94985,
        "gasPrijsMetEnergiebelastingInclBtw": 1.676649
      },
      {
        "id": "nextenergy",
        "naam": "NextEnergy",
        "geverifieerd": true,
        "vastPerMaandInclBtw": {
          "stroom": 5.99,
          "gas": 5.99
        },
        "gasPrijsInclBtw": 0.94415,
        "gasPrijsMetEnergiebelastingInclBtw": 1.670949
      },
      {
        "id": "pure",
        "naam": "Pure Energie",
        "geverifieerd": true,
        "vastPerMaandInclBtw": {
          "stroom": 6.05,
          "gas": 6.05
        },
        "gasPrijsInclBtw": 0.96415,
        "gasPrijsMetEnergiebelastingInclBtw": 1.690949
      },
      {
        "id": "tibber",
        "naam": "Tibber",
        "geverifieerd": true,
        "vastPerMaandInclBtw": {
          "stroom": 6.99,
          "gas": 5.99
        },
        "gasPrijsInclBtw": 0.9535,
        "gasPrijsMetEnergiebelastingInclBtw": 1.680299
      },
      {
        "id": "vandebron",
        "naam": "Vandebron",
        "geverifieerd": true,
        "vastPerMaandInclBtw": {
          "stroom": 6.995225,
          "gas": 6.995225
        },
        "gasPrijsInclBtw": 0.92498,
        "gasPrijsMetEnergiebelastingInclBtw": 1.651779
      },
      {
        "id": "vattenfall",
        "naam": "Vattenfall (FlexPrijs)",
        "geverifieerd": true,
        "vastPerMaandInclBtw": {
          "stroom": null,
          "gas": null
        },
        "gasPrijsInclBtw": null,
        "gasPrijsMetEnergiebelastingInclBtw": null
      },
      {
        "id": "zonneplan",
        "naam": "Zonneplan",
        "geverifieerd": true,
        "vastPerMaandInclBtw": {
          "stroom": 6.25,
          "gas": 6.25
        },
        "gasPrijsInclBtw": 0.94515,
        "gasPrijsMetEnergiebelastingInclBtw": 1.671949
      }
    ],
    "uren": [
      {
        "start": "2026-09-24T00:00:00+02:00",
        "startUtc": "2026-09-23T22:00:00Z",
        "marktInclBtw": 0.187903,
        "afnameInclBtw": {
          "anwb": 0.205903,
          "budget": 0.204723,
          "frank": 0.206053,
          "liveenergy": 0.212103,
          "nextenergy": 0.208903,
          "pure": 0.205893,
          "tibber": 0.205903,
          "vandebron": 0.209983,
          "vattenfall": null,
          "zonneplan": 0.207903
        },
        "terugleveringInclBtw": {
          "anwb": 0.187903,
          "budget": 0.187903,
          "frank": 0.175198,
          "liveenergy": 0.163703,
          "nextenergy": 0.187903,
          "pure": 0.169874,
          "tibber": 0.169903,
          "vandebron": 0.174293,
          "vattenfall": 0.187903,
          "zonneplan": 0.207903
        },
        "afnameMetEnergiebelastingInclBtw": {
          "anwb": 0.316751,
          "budget": 0.315571,
          "frank": 0.316901,
          "liveenergy": 0.322951,
          "nextenergy": 0.319751,
          "pure": 0.316741,
          "tibber": 0.316751,
          "vandebron": 0.320831,
          "vattenfall": null,
          "zonneplan": 0.318751
        }
      },
      {
        "start": "2026-09-24T01:00:00+02:00",
        "startUtc": "2026-09-23T23:00:00Z",
        "marktInclBtw": 0.184648,
        "afnameInclBtw": {
          "anwb": 0.202648,
          "budget": 0.201468,
          "frank": 0.202798,
          "liveenergy": 0.208848,
          "nextenergy": 0.205648,
          "pure": 0.202638,
          "tibber": 0.202648,
          "vandebron": 0.206728,
          "vattenfall": null,
          "zonneplan": 0.204648
        },
        "terugleveringInclBtw": {
          "anwb": 0.184648,
          "budget": 0.184648,
          "frank": 0.171943,
          "liveenergy": 0.160448,
          "nextenergy": 0.184648,
          "pure": 0.166619,
          "tibber": 0.166648,
          "vandebron": 0.171038,
          "vattenfall": 0.184648,
          "zonneplan": 0.204648
        },
        "afnameMetEnergiebelastingInclBtw": {
          "anwb": 0.313496,
          "budget": 0.312316,
          "frank": 0.313646,
          "liveenergy": 0.319696,
          "nextenergy": 0.316496,
          "pure": 0.313486,
          "tibber": 0.313496,
          "vandebron": 0.317576,
          "vattenfall": null,
          "zonneplan": 0.315496
        }
      },
      {
        "start": "2026-09-24T02:00:00+02:00",
        "startUtc": "2026-09-24T00:00:00Z",
        "marktInclBtw": 0.157772,
        "afnameInclBtw": {
          "anwb": 0.175772,
          "budget": 0.174592,
          "frank": 0.175922,
          "liveenergy": 0.181972,
          "nextenergy": 0.178772,
          "pure": 0.175762,
          "tibber": 0.175772,
          "vandebron": 0.179852,
          "vattenfall": null,
          "zonneplan": 0.177772
        },
        "terugleveringInclBtw": {
          "anwb": 0.157772,
          "budget": 0.157772,
          "frank": 0.145067,
          "liveenergy": 0.133572,
          "nextenergy": 0.157772,
          "pure": 0.139743,
          "tibber": 0.139772,
          "vandebron": 0.144162,
          "vattenfall": 0.157772,
          "zonneplan": 0.177772
        },
        "afnameMetEnergiebelastingInclBtw": {
          "anwb": 0.28662,
          "budget": 0.28544,
          "frank": 0.28677,
          "liveenergy": 0.29282,
          "nextenergy": 0.28962,
          "pure": 0.28661,
          "tibber": 0.28662,
          "vandebron": 0.2907,
          "vattenfall": null,
          "zonneplan": 0.28862
        }
      },
      {
        "start": "2026-09-24T03:00:00+02:00",
        "startUtc": "2026-09-24T01:00:00Z",
        "marktInclBtw": 0.185279,
        "afnameInclBtw": {
          "anwb": 0.203279,
          "budget": 0.202099,
          "frank": 0.203429,
          "liveenergy": 0.209479,
          "nextenergy": 0.206279,
          "pure": 0.203269,
          "tibber": 0.203279,
          "vandebron": 0.207359,
          "vattenfall": null,
          "zonneplan": 0.205279
        },
        "terugleveringInclBtw": {
          "anwb": 0.185279,
          "budget": 0.185279,
          "frank": 0.172574,
          "liveenergy": 0.161079,
          "nextenergy": 0.185279,
          "pure": 0.16725,
          "tibber": 0.167279,
          "vandebron": 0.171669,
          "vattenfall": 0.185279,
          "zonneplan": 0.205279
        },
        "afnameMetEnergiebelastingInclBtw": {
          "anwb": 0.314127,
          "budget": 0.312947,
          "frank": 0.314277,
          "liveenergy": 0.320327,
          "nextenergy": 0.317127,
          "pure": 0.314117,
          "tibber": 0.314127,
          "vandebron": 0.318207,
          "vattenfall": null,
          "zonneplan": 0.316127
        }
      },
      {
        "start": "2026-09-24T04:00:00+02:00",
        "startUtc": "2026-09-24T02:00:00Z",
        "marktInclBtw": 0.186282,
        "afnameInclBtw": {
          "anwb": 0.204282,
          "budget": 0.203102,
          "frank": 0.204432,
          "liveenergy": 0.210482,
          "nextenergy": 0.207282,
          "pure": 0.204272,
          "tibber": 0.204282,
          "vandebron": 0.208362,
          "vattenfall": null,
          "zonneplan": 0.206282
        },
        "terugleveringInclBtw": {
          "anwb": 0.186282,
          "budget": 0.186282,
          "frank": 0.173577,
          "liveenergy": 0.162082,
          "nextenergy": 0.186282,
          "pure": 0.168253,
          "tibber": 0.168282,
          "vandebron": 0.172672,
          "vattenfall": 0.186282,
          "zonneplan": 0.206282
        },
        "afnameMetEnergiebelastingInclBtw": {
          "anwb": 0.31513,
          "budget": 0.31395,
          "frank": 0.31528,
          "liveenergy": 0.32133,
          "nextenergy": 0.31813,
          "pure": 0.31512,
          "tibber": 0.31513,
          "vandebron": 0.31921,
          "vattenfall": null,
          "zonneplan": 0.31713
        }
      },
      {
        "start": "2026-09-24T05:00:00+02:00",
        "startUtc": "2026-09-24T03:00:00Z",
        "marktInclBtw": 0.191622,
        "afnameInclBtw": {
          "anwb": 0.209622,
          "budget": 0.208442,
          "frank": 0.209772,
          "liveenergy": 0.215822,
          "nextenergy": 0.212622,
          "pure": 0.209612,
          "tibber": 0.209622,